{
  "$schema": "http://json-schema.org/draft-07/schema#",
  "title": "PR Draft Artifact",
  "type": "object",
  "additionalProperties": false,
  "required": ["schema_version", "artifact_type", "lifecycle", "producer_role", "issue", "branch", "base_sha", "head_sha", "files_touched", "verify_cmd", "status"],
  "properties": {
    "schema_version": { "const": "1" },
    "artifact_type": { "const": "pr_draft" },
    "lifecycle": { "enum": ["draft", "active", "superseded", "final"] },
    "producer_role": { "enum": ["CODEX", "WORKER", "CONDUCTOR", "REVIEWER", "VERIFIER", "RELEASE"], "description": "Workflow role. CODEX is accepted only as a legacy producer identity." },
    "producer_runtime": { "enum": ["codex", "claude", "opencode"], "description": "Runtime that produced this artifact; required for runtime-neutral artifacts." },
    "producer_version": { "type": "string", "minLength": 1, "description": "Observed runtime CLI version; required for runtime-neutral artifacts." },
    "issue": {
      "type": "object",
      "additionalProperties": false,
      "required": ["number", "title"],
      "properties": {
        "number": { "type": "integer" },
        "title": { "type": "string" },
        "labels": { "type": "array", "items": { "type": "string" } }
      }
    },
    "branch": { "type": "string" },
    "base_sha": { "type": "string", "pattern": "^[0-9a-f]{40}$" },
    "head_sha": { "type": "string", "pattern": "^[0-9a-f]{40}$" },
    "summary": { "type": "string" },
    "files_touched": {
      "type": "array",
      "minItems": 1,
      "items": {
        "type": "object",
        "additionalProperties": false,
        "required": ["path", "change"],
        "properties": {
          "path": { "type": "string" },
          "change": { "enum": ["add", "edit", "delete"] }
        }
      }
    },
    "tests": { "type": "array", "items": { "type": "string" } },
    "verify_cmd": { "type": "string" },
    "verify_output_path": { "type": "string" },
    "risks": { "type": "array", "items": { "type": "string" } },
    "deviations": { "type": "array", "items": { "type": "string" } },
    "status": { "enum": ["ready_for_review", "needs_amendment", "abandoned"] },
    "verify_result": {
      "description": "DEPRECATED — conductor ignores this field. The canonical verification fact is ISSUE-<n>-VERIFY.json written by VERIFIER. Kept schema-allowed only for backward compatibility with existing artifacts.",
      "type": "object",
      "additionalProperties": false,
      "required": ["verified_head_sha", "passed", "failed", "exit_code"],
      "properties": {
        "verified_head_sha": { "type": "string", "pattern": "^[0-9a-f]{40}$" },
        "passed": { "type": "integer", "minimum": 0 },
        "failed": { "type": "integer", "minimum": 0 },
        "pending": { "type": "integer", "minimum": 0 },
        "exit_code": { "type": "integer" }
      }
    },
    "verify_artifact_path": {
      "type": "string",
      "description": "informational pointer only; conductor does NOT trust this — derives ISSUE-<n>-VERIFY.json deterministically"
    },
    "worktree_path": { "type": "string", "description": "optional: absolute path to the worktree this artifact's branch lives in; used by conductor-rebuild to resolve the branch's real HEAD" },
    "base_branch": { "type": "string", "description": "optional: the integration branch this feature branched from (e.g. 'develop' or 'feature/agent-workflow-trial'); used by artifact-fresh to compute merge-base instead of assuming develop" },
    "closure_binding": { "$ref": "#/definitions/closure_binding" }
  },
  "allOf": [{
    "oneOf": [
      { "type": "object", "required": ["producer_role"], "properties": { "producer_role": { "const": "CODEX" } }, "not": { "type": "object", "required": ["producer_runtime"] } },
      { "type": "object", "required": ["producer_role", "producer_runtime", "producer_version"], "properties": { "producer_role": { "enum": ["WORKER", "CONDUCTOR", "REVIEWER", "VERIFIER", "RELEASE"] } } }
    ]
  }],
  "definitions": {
    "closure_binding": { "type": "object", "additionalProperties": false, "required": ["issue", "round", "manifest_revision", "plan_revision", "candidate_head", "attempt_id", "generated_at"], "properties": {
      "issue": { "type": "integer", "minimum": 1 }, "round": { "type": "integer", "minimum": 1 }, "manifest_revision": { "type": "integer", "minimum": 1 }, "plan_revision": { "type": "integer", "minimum": 1 },
      "candidate_head": { "type": "string", "pattern": "^[0-9a-f]{40}$" }, "attempt_id": { "type": "string", "pattern": "^[A-Za-z0-9][A-Za-z0-9._-]*$" },
      "generated_at": { "type": "string", "pattern": "^\\d{4}-\\d{2}-\\d{2}T\\d{2}:\\d{2}:\\d{2}(?:\\.\\d+)?(?:Z|[+-]\\d{2}:\\d{2})$" }
    } }
  }
}
